{
  "kind": "rendered_view",
  "status": "complete",
  "views": [
    {
      "id": "m1",
      "type": "matrix",
      "columns": [
        {
          "labels": [
            "FY27-Q1",
            "orders.net_revenue"
          ],
          "total": false,
          "other": false
        },
        {
          "labels": [
            "FY27-Q1",
            "Share"
          ],
          "total": false,
          "other": false
        },
        {
          "labels": [
            "FY27-Q2",
            "orders.net_revenue"
          ],
          "total": false,
          "other": false
        },
        {
          "labels": [
            "FY27-Q2",
            "Share"
          ],
          "total": false,
          "other": false
        }
      ],
      "rows": [
        {
          "labels": [
            "West"
          ],
          "total": false,
          "cells": [
            {
              "v": 4200000,
              "text": "4.2M"
            },
            {
              "v": 0.38,
              "text": "38%"
            },
            {
              "v": 4600000,
              "text": "4.6M"
            },
            {
              "v": 0.39,
              "text": "39%"
            }
          ]
        },
        {
          "labels": [
            "Central"
          ],
          "total": false,
          "cells": [
            {
              "v": 3100000,
              "text": "3.1M"
            },
            {
              "v": 0.28,
              "text": "28%"
            },
            {
              "v": 3300000,
              "text": "3.3M"
            },
            {
              "v": 0.28,
              "text": "28%"
            }
          ]
        },
        {
          "labels": [
            "East"
          ],
          "total": false,
          "cells": [
            {
              "v": 3800000,
              "text": "3.8M"
            },
            {
              "v": 0.34,
              "text": "34%"
            },
            {
              "v": 3900000,
              "text": "3.9M"
            },
            {
              "v": 0.33,
              "text": "33%"
            }
          ]
        }
      ],
      "notice": null
    }
  ],
  "errors": null
}
